,Unnamed: 0,tweet,sarcastic,rephrase,sarcasm,irony,satire,understatement,overstatement,rhetorical_question
556,556,Just so @RealCandaceO I anger start? the does when Ok and,1,"I don't believe that this happens to everyone, and it won't happen to me.",1.0,0.0,0.0,0.0,0.0,0.0
570,570,"bank #mondays sit wanted must waiting person at to my card, day.. and all still stole I known thank kind",1,Someone stole my bank card and now I have to sit and wait in the bank all day unhappily.,1.0,0.0,0.0,0.0,0.0,0.0
352,352,talk catch are being my afraid 💘 they're about calls short that is incredibly that me grandparents to favorite,1,"I would say ""It's quite upsetting that phone calls with my grandparents are so brief because they avoid topics pertaining to my partner and personal life""",1.0,0.0,0.0,0.0,0.0,0.0
91,91,coin Raging on below of 6 if Definitely decided flip. League the Orlando by notch importance,1,An uninteresting conversation regarding the importance of an Orlando Magic Summer League title. ,0.0,1.0,0.0,0.0,0.0,0.0
697,697,did make I care last to Great! told Not me night covid have scrubs covid “unwantable”! nurse charge only,1,I can’t believe my charge nurse is judging how my scrubs look when I’m busy taking care of covid patients,1.0,0.0,0.0,0.0,0.0,0.0
348,348,Keanu his is reeves role in ozark,1,The brother in ozark looks just like Keanu reeves!,1.0,0.0,0.0,0.0,0.0,0.0
453,453,uni looool only have xxxxx to in 9k an mmmm take week for,1,9k is ridiculous for 1 hour of in person teaching a week.,1.0,0.0,0.0,0.0,0.0,0.0
37,37,give to Would me anyone money?,1,"I just watched a documentary about finical domination and would be interested in getting into this line of work, if anyone is interested please let me know - if being genuine. Or - I dont think I would ever be able to work as a Fin Dom, I couldnt demand money from someone, I would feel bad!",1.0,0.0,0.0,0.0,0.0,0.0
39,39,Apple to science. sure still Vaccinated no worked it's committed and autism Not,1,"Vaccinated this morning. The vaccine did not contain a Microsoft chip, nor did it make me more autistic than I already am.",1.0,0.0,0.0,0.0,0.0,0.0
169,169,"I the end it knackered is this Corsa. alloys is of encrusted diamond sticking shit feel mean, just at day. on is",1,Therapy can only do so much. ,1.0,0.0,0.0,0.0,0.0,0.0
737,737,"agreed, gotta ridiculous, this @adi_jord is",1,"I agree, I want them too",1.0,0.0,0.0,0.0,0.0,0.0
634,634,up. on. many get toes birks with too out man. fucking dudes,1,"At the end and, 'Im the guy wearing socks"".",1.0,0.0,0.0,0.0,0.0,0.0
579,579,"deterrent"" a @kirkkorner ""But",1,Making 'theft of a dog' a new offense in English law is definitely not an effective deterrent to potential dog thieves,1.0,0.0,0.0,0.0,0.0,0.0
328,328,I date get go scared swap be little phone on,1,I am not afraid that I will be on the show phone swap while I go on a for date,1.0,0.0,0.0,0.0,0.0,0.0
780,780,just at the as (and a five tangle start 2. to Prix saw and Leclerc Lovely fuck Sunday then the watch and jump Japanese a Grand on Verstappen turn,1,Disappointing morning as a Ferrari fan who woke up at 5:45am on a Sunday only for both drivers' races to be ruined by the first corner,0.0,1.0,0.0,0.0,0.0,0.0
159,159,Just his the to WD40 with getting #WD40 help some poor today #valentinesday2021,1,"Fed up of seeing forced romance, don't be told when to do something nice for a person you love.",0.0,1.0,0.0,0.0,0.0,0.0
2,2,regards we love emails I’ve Remember companies gotten when only @SavageXFenty shared matter... three And the capitalism for in support protests. from started helpful 🥰🙌🏼,1,"I, at the bare minimum, wish companies actually cared about marginalized communities. At the max, that our capitalistic society is dismantled. ",0.0,1.0,0.0,0.0,0.0,0.0
61,61,now release We're 9.10. we new pixie of the English to you the long up Hopefully date. to nice. @PONOS_EN,1,I am disappointed that it took so long to get to this point where we are up to date.,1.0,0.0,0.0,0.0,0.0,0.0
849,849,they i being prayer monitor gods insurance care system continue everyone approve alive. health love the to so that may the my heart,1,I hate the US health care system.,1.0,0.0,0.0,0.0,0.0,0.0
53,53,LOVE I've I days the how 3 just to in next heatwave. the,1,I hate working outside in the heat. ,0.0,1.0,0.0,0.0,0.0,0.0
258,258,swear this I is triller by,1,The Triller boxing event seems to be run very poorly by inexperienced people,1.0,0.0,0.0,0.0,0.0,0.0
505,505,"So is country does exam about tomorrow, but to it zone turn really an if into",1,I have to take this exam even when the world is falling apart. ,1.0,0.0,0.0,0.0,0.0,1.0
752,752,and it books order order bookstore finally when wait they email weeks you a about then book for 😍🥰 you week say them and cancelled from,1,"I would take out “when,” and insert more displeased looking emojis at the end or maybe have none at all",1.0,0.0,0.0,0.0,0.0,0.0
217,217,maybe bully a am,1,Telling someone when they’re wrong and being ignorant doesnt make me a cyber bully.,1.0,0.0,0.0,0.0,0.0,0.0
824,824,spending and in doing due assignments of at just of in order each a Woke: minutes on Broke: Wired: list doing down,1,"The best way to do assignments is in order of priority. The second best is in terms of due date. The worst is doing 20 minutes on each class at a time, regardless of priority.",1.0,0.0,0.0,0.0,0.0,0.0
771,771,a be sociopath I up grow,1,I wish I could stop feeling certain emotions.,1.0,0.0,0.0,0.0,0.0,0.0
806,806,just you’re shave friends? u oh,1,“You’re not “just friends” if you’re shaving your coochie every time you know you’ll see them.” ,1.0,0.0,0.0,0.0,0.0,1.0
398,398,"neighbors sleep, audacity trying at mow lawn of to i'm the",1,My neighbors mowed the lawn and woke me up,1.0,0.0,0.0,0.0,0.0,0.0
704,704,amount rabbits the this two control roughly their do Elaine as first exhibits over,1,Elaine Quijano lacks any control in moderating tonight’s debate. ,1.0,0.0,0.0,0.0,0.0,0.0
431,431,will I never is children wait have. be my son I Hope. after daughter things expensive. that because name My,1,In this tweet I would probably say. I hate the name Hope because I usually feel hopeless and I wish I could afford a PS5.,1.0,0.0,0.0,0.0,0.0,0.0
292,292,be to is alone. My,1,I simply do not want to be bothered by annoying people ever again.,1.0,0.0,0.0,0.0,0.0,0.0
145,145,a when spill you kill it it youre you dont your over and your all kill spider when and just me you theres then it,1,dont you hate it when youre just chilling in your room and then theres a spider and you kill it but when you kill it you spill soda all over your keyboard yeah me too,1.0,0.0,0.0,0.0,0.0,1.0
339,339,"but up oh gets my warning” sure, at the MLB softball says say pitcher player when game it 13 old she the",1,"MLB players can swear on TV and not get in trouble, but when a youth softball player does the same thing, she will get in trouble.",1.0,0.0,0.0,0.0,0.0,0.0
265,265,LAUNDRY LET Goodness. THE BASKETS. PILE,1,Why did I let the laundry pile up 5 baskets?,1.0,0.0,0.0,0.0,0.0,0.0
271,271,you didn’t @McDonaldsUK Acapulco’s swear 😘 down straight Say at bev’s,1,Didn't you have all the beverages at Acapulco's last night? ,1.0,0.0,0.0,0.0,0.0,0.0
696,696,a that’s by the meeting can life complete that schedules coordination psych in and took and because are of chances legal who you’re if bound only feel determines student’s fun School can,1,It's hard being a school psychologist because you can feel like complete garbage but chances are you have a meeting that determines changes in a student's education that's bound by legal timelines and took coordination of 6 different schedules and you're the only one who can run it.,0.0,1.0,0.0,0.0,0.0,0.0
244,244,is 5'7 5'8 my im short and think,1,I think people below the height of 5'8 is short.,1.0,0.0,0.0,0.0,0.0,0.0
476,476,"makes to I'm boy, Oh until play repeat a it! ill me on it",1,"""I can't stop listening to this new song from FOB""",1.0,0.0,0.0,0.0,0.0,0.0
813,813,drama is network favorite the social,1,i love the social network because it feels kinda gay,1.0,0.0,0.0,0.0,0.0,0.0
250,250,one? Thatcher' trending... another 'Margaret has,1,"Non-sarcastically I'd probably say ""Oh, out of curiousity, what's the reason for Ms. Thatcher trending?""",1.0,0.0,0.0,0.0,0.0,0.0
545,545,night shift: puppuccinio?” a Day triple “Can I,1,I need 3 shots of coffee,0.0,1.0,0.0,0.0,0.0,1.0
738,738,Why and breakfast drafted Kupp told not eat Robert I together was Cooper over,1,Interesting: Stafford and Cupp eat breakfast together.  ,1.0,0.0,0.0,0.0,0.0,1.0
310,310,"a With better tomorrow? coaching can the 😅 now we available, @Moffstovoi wee",1,"Well done, great achievement. Can only be mutually beneficial. ",1.0,0.0,0.0,0.0,0.0,0.0
15,15,thought I I those people but of like one who never bars. bounty,1,"No, it would be less logical.",1.0,0.0,0.0,0.0,0.0,0.0
363,363,their anthem World national Cup men the the manliest sing of I think thing,1,""" I think it's really manly when men sing their national anthem""",1.0,0.0,0.0,0.0,1.0,0.0
182,182,up you&gt;&gt;&gt; warmed when is seat,1,Ew this toilet seat is warmed up.,0.0,1.0,0.0,0.0,0.0,0.0
614,614,scantrons after “Christ” name gonna to shortening my,1,I'm not going to miss scantrons shortening my name to “Christ” after 16 years,0.0,1.0,0.0,0.0,0.0,0.0
401,401,as about Team jumping people or only and care up equality Remain much Leave. the If way and,1,People should care more about poverty and inequality than other less important matters.,1.0,0.0,0.0,0.0,0.0,0.0
726,726,of guilt followed accidentally guidelines have CDC instead CCD now catholic AND,1,"""Isn't it funny how CCD is really similar to CDC? Hope nobody mixes up the two""",1.0,0.0,0.0,0.0,0.0,0.0
826,826,out comes phone piece starts of turning Funny the iPhone my into when,1,Iphones are always bad when the new update comes out.,0.0,1.0,0.0,0.0,0.0,0.0
136,136,"13 @kumandgo memory can today &amp; prank Kum help is owe to to. I repressed Go, school this &amp; recovered “we calls working sure go K&amp;G phone I Shelby. at the in How as you?” of",1,I don't think K&G owes me therapy.,1.0,0.0,0.0,0.0,0.0,0.0
628,628,watch #TheCrown deep-dive wiki you you The watch did don’t simultaneously even If,1,"I always simultaneously wiki deep-dive the royal family, when I watch The Crown.",1.0,0.0,0.0,0.0,0.0,1.0
334,334,casual business Crocs not aware was were,1,I do not think that Crocs are appropriate professional footwear.,0.0,1.0,0.0,0.0,0.0,0.0
390,390,just alarm saw not i but to anyone,1,"ALERT, spider-man is on the uta campus.",1.0,0.0,0.0,0.0,0.0,0.0
710,710,😩” ride with for decide supposed women so to when leave were love be or finally problem “You making they putting how mistreatment were my god Men,1,"Men love making women think they were the problem when they finally decide to leave after putting up with mistreatment for god knows how long 

“You were supposed to be my ride or die 😩”

Does that mean that you die now?",1.0,0.0,0.0,0.0,0.0,0.0
338,338,Pelosi #Nancy,1,He should not have been elected president and donald trump won the presidency.,1.0,0.0,0.0,0.0,0.0,0.0
215,215,another of healthcare meeting need remind universal through means people to to never explanation benefits,1,Universal healthcare saves a lot of time and makes life easier,1.0,0.0,0.0,0.0,0.0,0.0
101,101,"20 and by it about the take ears? stove, leave minutes one AirPod,",1,I left my Airpods out by the fire and now my ears are warm.,1.0,0.0,0.0,0.0,0.0,0.0
171,171,Hey simping? stop I how,1,I don't like that I put too much effort into someone who may not like me back.,1.0,0.0,0.0,0.0,0.0,1.0
107,107,is Herbert a,1,"""I don't know who Justin Herbert is""",1.0,0.0,0.0,0.0,0.0,1.0
481,481,me I'm losing nice else's. enough @myhermes give Please soon it Thanks them but DM my giving 😐 someone,1,I am unhappy that you have lost my parcel,1.0,0.0,0.0,0.0,0.0,0.0
405,405,for sale. previous for x x sand toddlers eating DM,1,"I would love a break from my children who have been misbehaving, for example they keep eating sand.",1.0,0.0,0.0,0.0,0.0,0.0
757,757,settle say ik but idk like why instagram r don’t won an they this they,1,"The republican claim of voter fraud was not based in fact and the majority of US voters voted for Joe Biden, and that would be true in any re-voting process",1.0,0.0,0.0,0.0,0.0,1.0
97,97,this it Let’s my boyfriends how for attention. see see long trying tweet Been,1,Sitting next to my boyfriend but he'll notice me on twitter first.,1.0,0.0,0.0,0.0,0.0,0.0
148,148,"my actually TV+, Apple on parents yet Goodness watching are streaming",1,Annoying that we have to use another streaming service to watch some TV,0.0,1.0,0.0,0.0,0.0,0.0
28,28,come in it true Not telling how voted #EUref,1,I voted leave/remain in the EU Referendum,1.0,0.0,0.0,0.0,0.0,0.0
692,692,"why picked so my heavy, light have had pick Yarn such house, Like, Why to have I and hobby? reading? heavy to a move back 🥲 Books are wondering",1,“I wish books were lighter.”,0.0,1.0,0.0,0.0,0.0,0.0
701,701,Because why that Makes partying” twice sense. it? to parties can’t just complete “I in Oh really last is,1,"I don't understand why you go out to so many parties, if you don't like parties.",1.0,0.0,0.0,0.0,0.0,1.0
454,454,the usual the that see turn with year for have started waiting new service. to off @Cardiffbus,1,I hate waiting for buses that don't turn up,1.0,0.0,0.0,0.0,0.0,0.0
609,609,I basic I enjoy and making too economic https://t.co/cHDBHaxBBR shit principles,1,This is completely made up and goes against basic economics.,1.0,0.0,0.0,0.0,0.0,0.0
167,167,the complex to definitely for every Thank or at ~5 not consistently super hours. my am ☺️☺️ 8 you,1,@ my apartment complex: please pick a time later in the day to mow the lawn. 8 am = cranky residents.,1.0,0.0,0.0,0.0,0.0,0.0
730,730,work get i that 8pm and home i’ll at at when i and is work 8am ❤️ she’ll love about will mine what at finish then,1,i hate the fact that when summer finishes work at 8 i leave for my job and then when i come home she has to go to her job again,0.0,1.0,0.0,0.0,0.0,0.0
587,587,Schadenfreude,1,After many years it is brilliant to laugh at germany ,1.0,0.0,0.0,0.0,0.0,0.0
441,441,a semester. @vsheltonsports see news covering best attempt on this For over my for good to,1,"I would say ""I have zero interest in sports, so definitely regretting the decision to sign up for a sports business class that's making me tweet about sports every day...""",1.0,0.0,1.0,0.0,0.0,0.0
236,236,rare @ray_harren really buy card,1,"Buy something that is of value, either stocks or other long-term investments",1.0,0.0,0.0,0.0,0.0,0.0
520,520,they’re say pineapple that people who pathological are,1,I feel like too many people say that they're allergic to pineapple when they really aren't.,1.0,0.0,0.0,0.0,0.0,0.0
735,735,"I sad that Wish hated, fucking the Elijah",1,The same without the ‘:(‘ at the end ,1.0,0.0,0.0,0.0,0.0,0.0
592,592,or 🍞🥐🥖 to substitute tip in dog's you yeast bread! 💕 active dry pinch! your the baking 💕 in,1,It would be gross to use the yeast in your dog's ears for baking bread.,0.0,1.0,0.0,0.0,0.0,0.0
706,706,is My how festive.,1,I have diarrhoea ,0.0,1.0,0.0,0.0,0.0,0.0
745,745,"Gray to am just too,,, David see",1,I am only 21.,1.0,0.0,0.0,0.0,0.0,0.0
513,513,or go on students are not when the tallies up with students just @UniofNottingham in @CllrDavidMellen rates @SallyLongford dependent @CllrDaveTrimble parties attended of times and up also 3 allowed by attendees. @registrarism the the coincidence Definitely that a,1,Yes there is a link and students are to blame for the rise in covid cases in our area. ,1.0,0.0,0.0,0.0,0.0,0.0
81,81,love GETTING work AN a means forward capitalist off living BODY i a look PART legit bc to where days get from getting where xoxo,1,"I hate that in order to get time off of work, I have to do something drastic like getting surgery",1.0,0.0,0.0,0.0,0.0,0.0
774,774,":) another from yes, bit the down...really makes more home afternoon with Ah",1,"""Ah yes, another afternoon with the WiFi down...makes working from home completely unbearable""",0.0,1.0,0.0,0.0,0.0,0.0
329,329,my warms everybody more seeing together administration #WycoPride come Westside’s than Nothing,1,Attacking wyco is dumb,1.0,0.0,0.0,0.0,0.0,0.0
822,822,is player Cunningham @PistonsGT Cade my 2K basketball,1,"""I'm not a Piston's fan but it would be really fun to play with them in 2K22.""",1.0,0.0,1.0,0.0,0.0,0.0
181,181,quick hey it question is or,1,Why is it so frickin warm in November someone lmk,0.0,1.0,0.0,0.0,0.0,1.0
164,164,queen’ all a school my just face Thank snapped with acne cream god accidentally over,1,"The tweet could be, ""oh my goodness I just accidentally snapped a rando guy from high school ‘yas queen’ with acne cream all over my face"" to make it not sarcastic. ",1.0,0.0,0.0,0.0,0.0,0.0
451,451,tequila 💃🍹🎉👨 salsa and I'm social my and going is party to,1,I hope my school of social work party is fun and not boring. ,1.0,0.0,0.0,0.0,0.0,0.0
327,327,Sitting good world's of mouth-breather on school first for the demystifying grad the job next really me,1,I was very annoyed today in my first class of the year because I sat next to someone who had very loud breaths.,1.0,0.0,0.0,0.0,0.0,0.0
312,312,"to for someone I'd middle the solve Getting crisis. ""get to the every watching like Olympics with their perspective"" aged health some men at",1,It's annoying that middle aged men are declaring people with mental health issues need to find some perspective; that's insensitive and unhelpful.,1.0,0.0,0.0,0.0,0.0,0.0
832,832,a Thanks https://t.co/zkkguY2g6M to @CadburyUK ruin Easter.,1,"@cadburys, you have ruined Easter",1.0,0.0,0.0,0.0,0.0,0.0
777,777,gone needs ‘drive toddler toilet’. you like it My like your it’ ‘drive to,1,My life priorities have changed ,1.0,0.0,0.0,0.0,0.0,0.0
799,799,quick the know for Thank enlightenment.😂 and @faith_hi you page @PalmerReport everything. your,1,"If you want to sound like a professional, dress like one.",1.0,0.0,0.0,0.0,0.0,0.0
54,54,pop Defrost jars. with that extra @ThePartridgePod of could Any cast to wanted the Magic. Hollyoaks. empty an recycling centre the,1,I would actually answer the question - 'Who would you want to spend a bank holiday with?' with an answer that I meant. I would be worried that people would mock me if I was honest though - I don't care when the tweet is clearly a joke.,1.0,0.0,0.0,0.0,0.0,0.0
768,768,A nOT be during PANDEMIC really being college must single when,1,"being single in college, especially during a global pandemic, is boring and disheartening",1.0,0.0,0.0,0.0,0.0,0.0
285,285,@tedcruz @Dream timeline,1,A US Senator should not be tweeting about Minecraft Youtubers. ,1.0,0.0,0.0,0.0,0.0,0.0
428,428,Good of a disposed morning! dead,1,Disposing of a dead opossum was not a pleasant way to start my day.,0.0,1.0,0.0,0.0,0.0,0.0
722,722,nail wear cats,1,It is quite obvious that cats do not actually wear nail polish.,1.0,0.0,0.0,0.0,0.0,1.0
326,326,get just that through same everytime one has 😤🙄 the interests sad no complex i’m /j i,1,Everytime i swipe through bumble when i’m bored i just get sad that no one has the same complex interests as me.,1.0,0.0,0.0,0.0,0.0,0.0
341,341,do @Dancruz07 Sureeeeeee,1,"I could've replied ""You do not despise me, you're my best friend.""",1.0,0.0,0.0,0.0,0.0,0.0
147,147,cannot best to more Taxes 😇🥰🥺 I and are,1,I dislike paying taxes.,0.0,1.0,1.0,0.0,0.0,0.0
848,848,my in video ten that scared I’m days telly now he will saw climb the,1,I did not like watching this video at all ,1.0,0.0,0.0,0.0,0.0,0.0
661,661,"college, so of instead oh get I’m from to know ANYTHING pay glad knowing quadratic ready grade BECOMING the USEFUL 🤠🥰 OR how",1,I don't like how I know the quadratic formula instead of how to pay taxes or get ready for college,0.0,1.0,0.0,0.0,0.0,0.0
24,24,"it’s though 👊🏻 only your 10pm, and up imagine service your them late, being coincidentally 2 up calling £3 at okay, imagine hang hours delivery same time refunded is",1,It's not acceptable for you to just refund my delivery fee. ,1.0,0.0,0.0,0.0,0.0,0.0
385,385,listening to tell because me birds they quiet to,1,I wish the birds outside would stop chirping.,1.0,0.0,0.0,0.0,0.0,0.0
566,566,John Wow v great album 4’43 Cage x,1,Kanye needs to actually release his album. ,1.0,0.0,1.0,0.0,0.0,0.0
126,126,bell kids &amp; my love with where on talking their face i'm about zoom i,1,I'm sick of listening to my coworkers talk about their kids & want to eat my lunch in peace!,1.0,0.0,0.0,0.0,0.0,0.0
355,355,"man, that's little crazy a @traves slow",1,"I guess I would tell the truth and say something like ""that is moderately crazy but not that crazy"".",1.0,0.0,0.0,0.0,1.0,0.0
827,827,like sounds ngl dream @AvatarOdin the,1,"dang, America sucks, right?",1.0,0.0,0.0,0.0,0.0,0.0
362,362,Drum and know.. stuff 🙏🏻🙏🏻🙏🏻 don't you dangerous,1,Drum and Bass is not dangerous due its high BPM,1.0,0.0,0.0,0.0,0.0,0.0
345,345,the meanest ever months off to in but in physically i cut little year play contact a fucking you’ve accordion to life ability emerge going the your o to a now every speak,1,I wish I could take time for myself to heal in the ways that I need to and emerge from it being able to play the accordion.,1.0,0.0,0.0,0.0,0.0,0.0
711,711,snowing okay??? I it heard but ??? anyone Can Sounds,1,I see that it is snowing. This is expected in January. Anyone can see that it is snowing.,0.0,1.0,0.0,1.0,0.0,1.0
10,10,"I ANY YOU. DARE CRUSHED, 4 https://t.co/yZlafy0lsd ME ON WHO DINOSAUR OLD BE PENSIONER GOLF TAKE AND",1,"Had a great time playing crazy golf with the family, and I won!",0.0,1.0,0.0,0.0,0.0,0.0
793,793,and times Halfway 😆♋️ 69 least through I snowboarding at sure,1,Halfway through snowboarding day 1 and pretty sure I have fallen at least 10 times.,1.0,0.0,0.0,0.0,1.0,0.0
94,94,morning Ah love burnt 🌄 out gotta,1,I hate feeling burnt out from work and the never-ending pandemic.,0.0,1.0,0.0,0.0,0.0,0.0
129,129,thinks called 'teeth midnight' start sam at who band should,1,In an alternate universe me and sam would have been in a band called teeth at midnight,1.0,0.0,0.0,0.0,0.0,0.0
516,516,further Ed be to inspire #Football https://t.co/JTI2qgSxUq Nothing pre-game watch him NFL than performance a by but just Nothing the can of #TestosteroneDeficiency kickoff the,1,Ed Sheeran should not be the opening act to the launch of the NFL season.,1.0,0.0,0.0,0.0,0.0,0.0
419,419,"fun what having is now good stomach a have cold issues, think I and oldest feel kiddos",1,This isn't a fun night both my kiddos are sick. ,1.0,0.0,0.0,0.0,0.0,0.0
477,477,me rewatch make don’t,1,“I’m going to rewatch panic on amazon”,1.0,0.0,0.0,0.0,0.0,0.0
820,820,until to lies face have 🥰❤️😭 the to your day someone,1,I hate when people lie to my face. It ruins my day when people lie to my face.,1.0,0.0,0.0,0.0,0.0,0.0
615,615,Lockdown. jigsaw highlight Absolutely them day even my year) some bought wait Finally cannot (maybe 55,1,I’m bored in lockdown which has now resulted in me buying jigsaws like an old woman ,0.0,1.0,0.0,0.0,0.0,0.0
131,131,I helped get bod grilled that cheese wish,1,Grilled cheese doesn't give you a summer bod,0.0,1.0,0.0,0.0,0.0,0.0
77,77,to okay say that ain’t it the I’m song so like,1,The say so song was good after the first 5 listens but after that it got annoying,0.0,1.0,0.0,1.0,0.0,0.0
724,724,@ZARA_Care Love before @zara basket to in the start😒 our meant,1,"'I hate everything in my basket selling out before the sale was meant to start""",1.0,0.0,0.0,0.0,0.0,0.0
375,375,my pain medication great It's and 😩😩😩😩😩😩 that back hurting soooo,1,"I took pain medicine for my back, but it still hurts. ",1.0,0.0,0.0,0.0,0.0,0.0
333,333,not tennis pick away tennis no did player up at @CityView1904 doubters British she in years years Canada at 2 @Uzzell01 she Bromley @Chris_Ransom not until left same a @BBCSport take old??.aware a trained will she her from that was,1,I could tell the person to go read up on some facts it may help there IQ,1.0,0.0,0.0,0.0,0.0,1.0
320,320,At I new!! but 💕😭 least paid bad what week finally,1,I had another bad day which is becoming common for me at the moment.,1.0,0.0,0.0,0.0,0.0,1.0
260,260,choice forward law. by friends through rather and to not my than,1,I would like to continue social distancing and not hugging people ever ,1.0,0.0,0.0,0.0,0.0,0.0
689,689,person like they their i a to blood failing Corsodyl spits when,1,“For people who spit blood when they brush their teeth” is not a very catchy tagline,0.0,1.0,0.0,0.0,0.0,0.0
138,138,"@BoardroomBoy effective masks Who'da not. more wearing links summarise, thunk... you. face for",1,"I would omit the ""who'da thunk"" part.",1.0,0.0,0.0,0.0,0.0,1.0
319,319,when supposed UCF starting to? tradition game it's,1,UCF football games get delayed or cancelled.,1.0,0.0,0.0,0.0,0.0,1.0
653,653,beautiful sexy so hard being this and everyday,1,"“I enjoy being hot, sexy, and beautiful.”",1.0,0.0,0.0,0.0,0.0,0.0
558,558,"Please thanks pls, online mutliplayer. consider Pretty filters",1,I want map filters on COD,1.0,0.0,0.0,0.0,0.0,0.0
112,112,lectures means Update: day waiting closed campus the they’ve going and https://t.co/kBTOqNpX3Z wasted on,1,"Although the uni has now closed the campus, I was able to get a lot of work done having to go in",1.0,0.0,0.0,0.0,0.0,0.0
531,531,things karaoke i couldnt flew are rage i would bc mic this well say into my yeah,1,I'm not doing great mentally right now.,1.0,0.0,0.0,0.0,0.0,0.0
