,Unnamed: 0,tweet,sarcastic,rephrase,sarcasm,irony,satire,understatement,overstatement,rhetorical_question
224,224,"and names be Jejunum, would triplets, @ Ilium for",1,"Duodenum, Jejunum, and Ilium would not be cute names for triplets because they are the names of the three parts of the small intestine. ",0.0,1.0,0.0,0.0,0.0,0.0
723,723,"about this got hours... for I book copy bad Writing of 127 up Kinda a autographed a reminded an now,",1,I could never survive an experience like the one in the film 127 Hours.,1.0,0.0,0.0,0.0,0.0,0.0
846,846,boyfriend was my middle Bobby school by geez really oh Brackins!! peaked my,1,"Unfortunately, 143 by Bobby Brackens was my song with my middle school boyfriend.",0.0,1.0,0.0,0.0,0.0,0.0
193,193,"finished into racism loved the the look in a vibes queen's just 1960s gambit,",1,"it's odd that the queen's gambit is set in the american south in the 1960s, yet never discusses racism",1.0,0.0,0.0,0.0,0.0,0.0
117,117,level one can do tudor,1,I want my a-level history course to be finished,0.0,1.0,0.0,0.0,0.0,0.0
645,645,effects so of side are the,1,The side effects of antidepressants can be concerning.,0.0,1.0,0.0,0.0,1.0,0.0
3,3,college “forced” not was I Today 🙃 my sureeee me to sure,1,"Today my pop-pop told me I was not ""forced"" to go to college. That's not true.",1.0,0.0,0.0,0.0,0.0,0.0
74,74,have go AC to time a https://t.co/jqjqG1dGOa wonderful,1,Literally the worst possible time to have my AC go out. ,0.0,1.0,0.0,0.0,0.0,0.0
467,467,"I'm know what ...😐 you, If So like. of follow my just I seeing show me to has",1,Twitter is showing that some people I follow are liking porn and I need to unfollow them to stop seeing that,1.0,0.0,0.0,0.0,0.0,0.0
5,5,"as department down to until months launch. poor, that I interpret deal with emoticon Ubisoft's at ""XD"": who servers the quietly shut poor after those choose it",1,It's a terrible name and the product sounds awful.,0.0,1.0,0.0,1.0,0.0,0.0
228,228,8 my when class in my choking water I love,1,It was embarrassing when I choked on water in front of my class. ,1.0,0.0,0.0,0.0,0.0,0.0
242,242,it. anyone don’t Harry got there’s think I the enough not news engaged?,1,I think we've all heard enough about Harry and Meghan's engagement.,1.0,0.0,0.0,0.0,0.0,1.0
622,622,I Red more If were play simply would Orioles,1,The Red Sox probably wish they could play the Orioles all season. ,1.0,0.0,0.0,0.0,0.0,0.0
110,110,college i nothing become can my life a quitting path do wrong advisor be im for about on,1,"College advisors are not nearly as helpful as they should be, in fact they are often the opposite.",1.0,0.0,0.0,0.0,0.0,0.0
232,232,pumpkin afford been chai want latte with foam and can’t another i hours,1,“i am going to go broke if i keep buying iced chai lattes”,1.0,0.0,0.0,0.0,0.0,0.0
66,66,I been get at to doing rate think physics this 😂😂😂😭 I never going all deserve break,1,"I've been doing physics for 40 minutes, i cant take a break or I'm never going to get it all done at this rate",1.0,0.0,0.0,0.0,0.0,0.0
536,536,is full tictactoetok,1,Tiktok's name is Tiktok,0.0,1.0,0.0,0.0,0.0,0.0
125,125,"you @FandFclothing clothing and Gap, of about as a a has range West how",1,I think Kanye West and Gap is a terrible collab.,1.0,0.0,0.0,0.0,0.0,0.0
484,484,are stunning👌 snapchats Mine just,1,Our Snapchat’s are incredibly unattractive ,1.0,0.0,1.0,0.0,0.0,0.0
364,364,a Love cry,1,"I would say ""I hate when someone makes me cry""",1.0,0.0,0.0,0.0,0.0,0.0
27,27,and stop carbon concerning now that just at Not won't with he's left been the monoxide the a,1,Very concerning that a man's just been round to fiddle with the boiler and now he's left the carbon monoxide alarm won't stop beeping,1.0,0.0,0.0,0.0,0.0,0.0
473,473,#Covid_19 ration spend I #CoronaVirusUpdate am walk take I I food the a sitting a I day one my,1,My days are spent doing nothing.,1.0,0.0,0.0,0.0,0.0,0.0
525,525,motivation do basically to friend. How find anything? one,1,"""How does somebody find motivation to do basically anything? I haven't had motivation in ages.""",1.0,0.0,0.0,0.0,0.0,0.0
725,725,@mcfcok82 and Thank you for your well,1,There was no need for that ,1.0,0.0,1.0,0.0,0.0,0.0
55,55,"(at to prices!) from feed with with time three me empathy a from Bristol boot family very chronic airport vagueness travelling with staff, young @easyJet, £3 to Edinburgh So,",1,To buy an airport meal with a £3 voucher is impossible.,1.0,0.0,0.0,0.0,0.0,0.0
638,638,girl to would Eastpointe hot like Thank to you! I Chick-Fil-A.,1,I won't be eating at the Eastpointe Chick-Fil-A this summer.,0.0,1.0,0.0,0.0,0.0,0.0
302,302,health the in Worked quite fitness out epitome a and 2 literally,1,"i've worked out for two days in a row, i feel healthy.",1.0,0.0,0.0,0.0,0.0,0.0
624,624,aged This @Mike_Fabricant,1,This didn't age well.,1.0,0.0,1.0,0.0,0.0,0.0
336,336,"Pico real anime I'll fan? Oh? characters, the wait. Name no",1,Real fans don't have to prove themselves to anyone by listing off arbitrary facts. ,1.0,0.0,0.0,0.0,0.0,0.0
47,47,Does at we have bar? 11 5 it’s promoting disgrace once at and way to the @GNev2 kids. do over going into he OR each @AlexShawESPN @robwishart we Either should not,1,I don’t think he drank 11 beers every hour,1.0,0.0,0.0,0.0,0.0,1.0
106,106,only fitted you had wait! press wear house...oh he jumpsuits! you it!!! the If lovely can't If at for to get Time @DonaldJTrumpJr anymore in,1,I would point out that how can a President be censored if he has his own press Corp right there in the White House,1.0,0.0,0.0,0.0,0.0,0.0
523,523,doesn't candle the on and sub-zero by I've will math The BTC daily out lie. Actually turns,1,I'm not entirely sure you -can- say the same thing non-sarcastically. I suppose... 'Constantly calling for lower targets is ridiculous.',1.0,0.0,0.0,0.0,0.0,0.0
603,603,FORESTS. RAKE #Debate2020 ONLY THE WOULD,1,The president seems to believe that merely removing leaves from forest floors would prevent forest fires.,1.0,0.0,0.0,0.0,0.0,0.0
60,60,young and Care basically the your and for bed is bath,1,Social care for the young is non existent.,1.0,0.0,0.0,0.0,0.0,0.0
671,671,I with Bristol absolutely littered students!! Glad was,1,I was one of them once,1.0,0.0,0.0,0.0,0.0,0.0
92,92,@freedomsenpai loli @rits_meg,1," great art, involve rinako-chan",1.0,0.0,0.0,0.0,0.0,0.0
666,666,dont wondering of crying a into text didnt a hobbies As time dreams spend I doughnuts all woman goals cause,1,Women have more going on in their life than their romantic relationships.,1.0,0.0,0.0,0.0,0.0,0.0
280,280,a for kill would a man forehead,1,"""I'd love a forehead kiss rn""",1.0,0.0,0.0,0.0,1.0,0.0
359,359,let would sleep... be if It me my,1,I wish my body would let me sleep.,1.0,0.0,0.0,0.0,0.0,0.0
760,760,brain i’m to officially that so dead announce guys!,1,I am mentally unwell and struggling,1.0,0.0,0.0,0.0,1.0,0.0
42,42,adulthood is Brita 90% just pitcher.,1,I have to refill my Brita pitcher too often.,0.0,1.0,0.0,0.0,1.0,0.0
204,204,night I've 👍🏻 and out I off gone a sick.... bed and excellent,1,It’s not fair how I’m unwell yet my brother can head out on a night out ,1.0,0.0,0.0,0.0,0.0,0.0
68,68,theory physics guess could math..... knowing i too i conceptual for string alas,1,I could have said that I was too dumb for conceptual physics. ,1.0,0.0,0.0,0.0,0.0,0.0
137,137,a that friend hate ASL I in Accidentally,1,"I would say ""Made a friend in ASL today. I love when that happens.""",1.0,0.0,0.0,0.0,0.0,0.0
796,796,"long there? a do car Green elope to question: family prison? up, shut I I I got my nick and to if a PhD Can",1,"I like the idea of stealing a car in order to elope, but can't drive and it's illegal - so I wouldn't do that. ",1.0,0.0,0.0,0.0,0.0,1.0
758,758,"for among dont hot red guy, hes us",1,Red among us guy is not on my list of hot celebrities.,0.0,1.0,0.0,0.0,0.0,0.0
541,541,only put can my I warmth is toes and leach decided am the 30 his a male that him 3 of,1,I love putting my freezing cold toes on men to leach their warmth.,1.0,0.0,0.0,0.0,1.0,0.0
165,165,"have I to foot pressure it no me for how, Love that like days idea hurt 3",1,"I really do not love hurting my foot, it's really painful! ",1.0,0.0,0.0,0.0,0.0,0.0
248,248,my his my on off means screen which cheating took obvi,1,My boyfriend is cheating on me ,1.0,0.0,0.0,0.0,0.0,0.0
446,446,into that Love my car someone,1,"I could say ""I hate that someone broke into my car this morning.""",1.0,0.0,0.0,0.0,0.0,0.0
434,434,working too mental in change. a and long illness? at hand where thing same for for my for,1,I'm fed up of being mentally ill and would like to get better,1.0,0.0,0.0,0.0,0.0,0.0
577,577,"a order, whole A rejoice for",1,2% off of single order is a basically useless coupon.,1.0,0.0,0.0,0.0,0.0,0.0
762,762,my lot is https://t.co/pE5isUMOpk to life better say,1,I started the year completely dependent on someone else and ended it entirely dependent on myself for the first time in my life,1.0,0.0,0.0,0.0,1.0,0.0
388,388,send on to trying mother doing of things a is i pictures time and every date first question fun one my tell if of what,1,my mom thinks i'm dating every one of my friends whenever i send her pictures because she thinks i'm lonely. ,1.0,0.0,0.0,0.0,0.0,1.0
235,235,much I not so pregnant thing it’s about myself,1,Im happy not having children.,1.0,0.0,0.0,0.0,1.0,0.0
267,267,I you was mins or que . today .sits till early my #Seriously 56 let days one in cannot went able . to arm ! in Wait to @NicolaSturgeon the down Center get 2nd to 30 ready We !!!,1,I was to undertake my 2 covid vaccination but unfortunately I turned up 12 hrs to early and could be completed until after 56 days,1.0,0.0,0.0,0.0,0.0,0.0
770,770,will girls. talking old to this this 30 trying me man authorities call and about younger with dating the getting at,1,"I wouldn't even say I will call the authorities, or I would be more specific and say police. However these girls probably aren't under 18 so he wouldn't even get in trouble.",1.0,0.0,0.0,0.0,0.0,0.0
437,437,"I ubers is word pounding, have write spent night £25 on last a and report",1,I am really hungover and spent too much money last night even though I have too much work to do,1.0,0.0,0.0,0.0,0.0,0.0
673,673,unbiased to @SkyNews? What,1,Sky news is bias,1.0,0.0,0.0,0.0,0.0,1.0
249,249,me some x Gonna go now told no cry,1,Fuck the person who told me to lose weight,1.0,0.0,0.0,0.0,0.0,0.0
448,448,yet So venmoed how really one the Venmo thought was,1,there is no way I would win a contest that millions of people are entering ,1.0,0.0,0.0,0.0,0.0,0.0
716,716,in phone on at his musical room the the mashup music the with at A fun is volume playing one country locker,1,"""A terrible mashup is hearing country music & Eminem through someone's phone speaker. """,0.0,1.0,0.0,0.0,0.0,0.0
82,82,morning love then is ingesting and my tummy next why i,1,Every time I drink I wake up with an upset stomach,1.0,0.0,0.0,0.0,0.0,0.0
475,475,love in a panic up,1,I do not like waking up in a panic,0.0,1.0,0.0,0.0,0.0,0.0
517,517,love when said I from apparently and stuff learn done,1,I absolutely hate when I learn about things I have done from other people. ,1.0,0.0,0.0,0.0,0.0,0.0
404,404,it and seeing stop wen Looooolll. my people,1,"Non sarcastically I would say ""I hate it when people try and get in between me and my friends"" ",1.0,0.0,0.0,0.0,0.0,0.0
384,384,up Twitter to it opened are you of reload the when after reading just just in seconds,1,I hate when Twitter decides to reload the timeline seconds after you just opened it up and are in the middle of reading it.,1.0,0.0,0.0,0.0,0.0,0.0
688,688,communities. and living move mentally am spiritually to Stop gatekeeping,1,Getting old is hard. I miss not having to worry about everything.,0.0,1.0,0.0,0.0,0.0,0.0
62,62,JUSTICE HAS DONE.,1,Justice will never be done,1.0,0.0,0.0,0.0,0.0,0.0
852,852,is wait the solo what that,1,That solos was awful,1.0,0.0,0.0,0.0,0.0,1.0
223,223,protected never had,1,I always use protection when having sex,1.0,0.0,0.0,0.0,0.0,0.0
373,373,possibly we haven't But with a relentlessly we @avsmph can experience,1,"Our field shouldn't try to force human experience into quantifiable models, but it pretty consistently does.",1.0,0.0,0.0,0.0,0.0,1.0
9,9,not mean you sure yes on #ImACeleb her !!! MBE nope ??? #MBE,1,"Holly Arnold seem like a nice lady, just feel that keeping on about having an MBE may start to annoy her fans.",1.0,0.0,0.0,0.0,0.0,1.0
708,708,spend on friend it for Is unreasonable Asking bonsai tree? to,1,Would it be wrong to spend £50 on a bonsai plant?,1.0,0.0,0.0,0.0,0.0,0.0
255,255,[CHIRPBIRDICON] this site,1,I love this site,1.0,0.0,0.0,0.0,0.0,0.0
389,389,"have let my an don’t bills. account to form me an to so help bills, money GoFundMe a accounts ?? socialism? money",1,I would probably word it as a question:  Do you think that using Go Fund Me to ask for money to pay bills is a form of socialism?,1.0,0.0,0.0,0.0,0.0,1.0
739,739,bruh isn’t Liga @FCBGox Did anymore a even you last Varane la game that,1,"You didn't watch Varane last season, if you did, you would have a different opinion.",1.0,0.0,0.0,0.0,0.0,1.0
40,40,ITS HOOOOOME,1,It’s coming Rome,1.0,0.0,0.0,0.0,0.0,0.0
539,539,u flags to would i @kashirenaii six,1,I would go to Six Flags with you.,1.0,0.0,0.0,0.0,0.0,0.0
372,372,energy and communities pessimism don't upset haha love really at they upbeat,1,yes,1.0,0.0,0.0,0.0,0.0,1.0
667,667,it..... was 😪😩 up worth late,1,Staying up late was not worth it.,1.0,0.0,0.0,0.0,0.0,0.0
357,357,"BEST. Teas are Twisted joke, No",1,Twisted Teas are the best.,0.0,1.0,0.0,0.0,0.0,0.0
470,470,i’m hardworking your i’m strengths ill fast i’m demand i’m what little i’m so i’m i’m of wood i’m awesome me: smart employer: made i’m nice honest hot,1,"I could elaborate more on the strengths that make sense (creative, hardworking, etc) and to include those that are clearly false, I could make it a metaphor that would show the employer that I can think outside of the box. Of course, some of the original message could be left out for a more realistic approach.",1.0,0.0,0.0,0.0,0.0,0.0
79,79,So I ever https://t.co/mNJw5GvPzy favourite Tinnitus it. love thing my,1,My tinnitus is so annoying,1.0,0.0,0.0,0.0,0.0,0.0
814,814,i after serving trust breakfast are restaurants am 10:30/11 issues tex-mex have,1,I don't like when Tex-Mex restaurants stop serving breakfast tacos after 10:30/11 am.,1.0,0.0,0.0,0.0,0.0,0.0
133,133,Finally @davidschneider the for is @NiaAnts @andy_mansell72 up speaking,1,Billionaires do not need anyone to speak up on their behalf.,1.0,0.0,0.0,0.0,0.0,0.0
823,823,into lol is skincare my Rubbing tears my my,1,I rub my tears into my face to make them go away.,1.0,0.0,0.0,0.0,0.0,0.0
504,504,"me. In sleep downright fact, annoyance. levels truly New to insignificant of",1,"New levels of desperation: my lack of sleep is not a joke, in fact it’s a downright annoyance ",1.0,0.0,0.0,0.0,0.0,0.0
828,828,learned excommunication too goes cancel far think who,1,People who think cancel culture go too far don't understand the history of humans feelings on inappropriate matters and are most likely un-dually affected by opposing parties. ,1.0,0.0,0.0,0.0,0.0,0.0
652,652,vest are virgos in,1,virgos act like leos,1.0,0.0,0.0,0.0,0.0,0.0
172,172,love signals🙄 we,1,I hate mixed signals. ,1.0,0.0,0.0,0.0,0.0,0.0
38,38,trust my I very national https://t.co/mtkWJCxwom excited that am a arrived,1,I am officially a national trust member,1.0,0.0,0.0,0.0,0.0,0.0
713,713,backup perfect And @TheBabylonBee hot she generates and energy a source!,1,The amount of time spent listening to and comprehending what this gal says is disturbing and disappointing.,1.0,0.0,0.0,0.0,0.0,0.0
90,90,6:25pm love on at assignments a,1,Please do not give me an assignment right before I clock out because now I have to work overtime,1.0,0.0,0.0,0.0,0.0,0.0
216,216,the that airport left and the i time on is all connector today,1,"I'm so mad that I'm stuck in traffic and late to school, especially because I left early.",0.0,1.0,0.0,0.0,0.0,0.0
510,510,“let’s many I how see It’s in szn.,1,"I hate carrying crumbs in my scarf all day, everyday.",1.0,0.0,0.0,0.0,0.0,0.0
499,499,jerseys It was,1,Theyre embarrassed of their uniforms so theyre playing badly ,1.0,0.0,0.0,0.0,0.0,0.0
750,750,like Wow South the 10 Feels in Parks catch degrees!! me,1,It's going to be pretty cold in South Parks today!,1.0,0.0,0.0,0.0,0.0,0.0
234,234,"the Henri, #nffc win done us",1,"Terrible Henri,  you cost us the win.",1.0,0.0,0.0,0.0,0.0,0.0
732,732,game’ ‘It’s a,1,Look how important these clubs are to their fans!,1.0,0.0,0.0,0.0,0.0,0.0
143,143,use an was Facebook seen recently. find any if there website AirBnB 🤔 AirBnB if groups was I’ve owners lot availability of people If available out,1,There is a website you could use to check if the airbnb is available ,1.0,0.0,0.0,0.0,0.0,0.0
850,850,spaces are public toddlers in,1,I do not enjoy having to listen to loud toddlers in public spaces. ,1.0,0.0,0.0,0.0,0.0,1.0
717,717,@kittin_knittin a size. Trump to video. a According that's There's Penis,1," According to past history with Trump Republicans, you must fact-check everything.   There is no credibility in the Republican party since Trump was in office.",1.0,0.0,0.0,0.0,0.0,0.0
264,264,an if am even looks leave. me shopping I a employee will in and physically online,1,I like online shopping because I am shy.,1.0,0.0,0.0,0.0,0.0,0.0
75,75,news. @WalesOnline,1,What a boring tweet.,1.0,0.0,0.0,0.0,0.0,0.0
395,395,"girl gotten. it said be ever I’ve to the she’s can might behind slip kinda kinda skinny, something?” me, dad you’re look you just So to tell compliment the",1,Don’t tell your girl shes “kinda skinny”.,1.0,0.0,0.0,0.0,0.0,0.0
396,396,"Makes of England bunch ""a described you pub Marxists"". proud the Someone it?",1,"Someone in the pub just described the England team as a ""bunch of Marxists"". What an idiot!",1.0,0.0,0.0,0.0,0.0,1.0
595,595,book the 2 character. hate main into Lovely already,1,I do not enjoy the main character of this book.,0.0,1.0,0.0,0.0,0.0,0.0
36,36,be it’d 🐦 was 2020 a,1,My nose is awful,1.0,0.0,0.0,0.0,0.0,0.0
675,675,laid Nice:)) !! off,1,"""I can't believe I've been laid off. Super upset and nervous.""",1.0,0.0,0.0,0.0,0.0,0.0
728,728,myself call customizable boob job get so i doll,1,"""I want to get top surgery so I can remove all the fat on my chest and look more gender neutral.""",1.0,0.0,0.0,0.0,0.0,0.0
412,412,some thunder or like something? Anyone,1,Anyone else hear that thunder?,0.0,1.0,0.0,0.0,0.0,1.0
825,825,👶🏼 treating well asked is kid’s I today...21 me got if,1,"""I got asked if I needed a kid's menu today...21 is not treating me well. I wish I looked my age.""",1.0,0.0,0.0,0.0,0.0,0.0
616,616,your love when a they 😠 you dig it Don’t Saturday just,1,I hate it when I’m woken up by workmen digging up the road at 8:30am on a Saturday,1.0,0.0,0.0,0.0,0.0,0.0
114,114,🤷🏻‍♀️ don’t have absolutely with it’s much problems perfect to think just,1,I wish there was a way to have a perfect life. ,1.0,0.0,0.0,0.0,0.0,0.0
417,417,"Wow ""coping hearing doctor!"" internet help a see and strategies to",1,"""This is not at all helpful information.""",0.0,1.0,0.0,0.0,0.0,0.0
89,89,bomb forgot absolutely over me today me typhoon to,1,the typhoon flew over me today and i didnt get bombed ,1.0,0.0,0.0,0.0,0.0,0.0
753,753,"people shit"" it I run. ""eat do. Hutch nice while to at on me the Leave",1,Mean people yelled at me to eat shit.,1.0,0.0,0.0,0.0,0.0,0.0
11,11,See well is,1,Brexit really isn't going to plan.,0.0,1.0,0.0,0.0,0.0,0.0
284,284,hospital short at works 13 the days call hours. *checks love watch* is,1,I hate when Rob works short call and is still at the hospital for 13+ hours.,1.0,0.0,0.0,0.0,0.0,0.0
851,851,join holiday my 🖕🏻🖕🏻🖕🏻🖕🏻 tonsillitis me on to,1,I hate that I got tonsillitis while on holiday,1.0,0.0,0.0,0.0,0.0,0.0
496,496,to an is in AR-15 testing a 😍😝 coronavirus to gotta love it easier living,1,"When I wrote this tweet, COVID testing was really inaccessible. That has somewhat changed but I was really trying to make a comment about how healthcare is a human right and how poorly our country is handling the pandemic. Owning a military-grade weapon isn't really necessary for human life. While I absolutely believe in the right of the working class to arm themselves (although not with an AR-15...), I just think it's ridiculous the barriers that are put up for people when accessing quality healthcare. I think it's run like a business in this country, and it's immoral.",1.0,0.0,0.0,0.0,0.0,0.0
335,335,a research Montana 10 purposes. deeply to Cyrus 1 influenced Hannah album? how double scale was for 2: Meet the,1,Who else remembers the Hannah Montana 2: Meet Miley Cyrus double album?,0.0,1.0,0.0,0.0,0.0,0.0
515,515,I’ve animal is always legend spirit what @MasterChefUK my but the known confirms seeing mess man that,1,Bez might be messy but he's a great chef,1.0,0.0,0.0,0.0,0.0,0.0
356,356,"Neeson Wow. coming man,isn't a is rational across",1,"Just because he had a family member attacked by a black person, doesn't give Liam Neeson the right to kill a random person of colour.",1.0,0.0,0.0,0.0,0.0,1.0
550,550,"it You’re right, conspiracy. in they’re one it’s boycott should the on @KellyMartin_UK as well",1,If you truly really believe there is a conspiracy you should boycott the NHS too,1.0,0.0,1.0,0.0,0.0,0.0
153,153,great Efy,1,"EFY is a time for white, religious kids to make weird friends and mess around while not doing anything productive.",0.0,1.0,0.0,0.0,0.0,0.0
580,580,was akip Neros 😴😵 the the and to on now going Great,1,I had the worst start to the day as cafe nero was shut and I couldn’t get a coffee ,1.0,0.0,0.0,0.0,0.0,0.0
703,703,"good pretty a the season now, I’m is is 1 than right following price is lot of",1,Stranger Things is pretty good but season 1 is better than season 2,0.0,1.0,1.0,0.0,0.0,0.0
487,487,has released #Kojima taken PS4 funny #PT #Spooky #PlayableTeaser on before My Pro was is as P.T #SilentHills which #konami,1,I have managed to transfer PT to my PS4,0.0,1.0,0.0,0.0,0.0,0.0
559,559,YOURE 😭 screenings invitation THINKING bloody YES Got school - ONE quit and film THAT a OF are tempted a -,1,I would like to go to the film screening if I could,0.0,1.0,0.0,0.0,0.0,0.0
512,512,"kinds #76ers #ATLvsPHI those Lucky MVPs only #hawks , @JoelEmbiid of tossed",1,I would say Embiid wasn't good enough to win MVP,1.0,0.0,0.0,0.0,0.0,0.0
633,633,scoop cream idea a good that the to faster Hailey microwave was ice,1,we had to tell her it was a bad idea to put a spoon in the microwave ,1.0,0.0,0.0,0.0,0.0,0.0
116,116,"it on stupid ""Dems to say/write it in disarray"" account as",1,"Don't say ""dems in disarray,"" because they aren't.",1.0,0.0,0.0,0.0,0.0,0.0
740,740,their dads with til pudgy wait the bunch a of save,1,People are more likely to be injured when they own firearms.,1.0,0.0,0.0,0.0,0.0,0.0
830,830,being love the mom good and to trying they’re so horse my started bad actually for about covid bc cheap just worm it,1,"""I hate seeing that my mom has officially started posting about the horse worm medicine being good for covid, and thinks they’re just trying to make it look bad bc it’s so cheap."" with no emojis",1.0,0.0,0.0,0.0,0.0,0.0
119,119,I how about just to have email??? send,1,I would rather quit my job than do any of the work I am explicitly paid to do. ,1.0,0.0,0.0,0.0,0.0,0.0
656,656,a spunk Is,1,I am worried that I may have used a slur by saying the work spunk today ,0.0,1.0,0.0,0.0,0.0,1.0
635,635,home get found realize committed didn’t my family lucky lmao wtf my and journal,1,"My family read my quarantine journal, I didn't get committed. ",1.0,0.0,0.0,0.0,0.0,0.0
369,369,crispy ✌🏻 day @goldfishbabe101 here over,1,"""dry but honestly not mad about it.""",1.0,0.0,0.0,0.0,0.0,0.0
268,268,"the bin. daily test Starbucks in about cup occasional the room their lenses,"" impact ""I'm the environmental",1,You can't care about the environment only when it's convenient to you. ,1.0,0.0,0.0,0.0,0.0,0.0
46,46,to excited!!! at be so three tonight! on going of,1,i’m not ready to go to work after only getting three hours of sleep last night.,1.0,0.0,0.0,0.0,0.0,0.0
773,773,"and of tweet a Here I'm thing, I another like gonna so list done I'm day, complain things are: him! he's but",1,My roommate has no redeeming qualities,1.0,0.0,0.0,0.0,0.0,0.0
4,4,not heat Cancun when he did his constituents of @littlewhitty without also Mexico. Cruz worrying to I reported or heartbeats,1,I would say Ted Cruz is an asshole and doesn’t actually care about people/babies/fetuses. He just wants to wage a war on women and keep the patriarchy in power.  ,1.0,0.0,0.0,0.0,0.0,0.0
837,837,GOTY like strong contender @majornelson Sounds,1,"This game is terrible, it will definitely not win a GOTY award. ",0.0,1.0,0.0,0.0,0.0,0.0
681,681,the @devisridhar chippies area? any of good Do,1,What are your qualifications in epidemiology?,1.0,0.0,0.0,0.0,0.0,1.0
574,574,"and just ""oftenly"" read, a up little. in",1,"I would point out ""oftenly"" is not a word in the English language. I would explain the grammar and correct the weird to often",1.0,0.0,0.0,0.0,0.0,0.0
50,50,to 👍 @Schlippertysch1 on Very Just now work your,1,Excuse me but I think that you have made a spelling error on your last comment there.,1.0,0.0,0.0,0.0,0.0,0.0
